Question,
Give the details of the departments,
Give information about job candidates,
List all the departments,
Show me the details of all employees working in the Marketing department,
What is UK human right act 1998 from document,
What is the minimum qualification for the assistant proffessor in Bennet University from document,
What is Statuary Holidays mentioned in document,
What is Drug Free Workspace in the city of Reykjavik in document,
What is Pension scheme as mentioned in IHVN HR document





